{
  "id": "fdic-analysis-mcp",
  "kind": "tool",
  "version": "1.0.0",
  "title": "FDIC Analysis MCP Tools",
  "summary": "FDIC analytical and comparison tool bundle. Provides health assessment, peer benchmarking, risk signal detection, credit concentration, funding profile, securities portfolio, UBPR analysis, market share, franchise footprint, holding company profile, and regional context tools.",
  "owners": ["fdic-mcp-maintainers"],
  "tags": ["fdic", "mcp", "analysis", "comparison", "risk"],
  "tools": {
    "mcp": {
      "toolsets": [
        "../../shared/toolsets/fdic-analysis.json"
      ],
      "preferred": [
        "fdic_analyze_bank_health",
        "fdic_compare_peer_health",
        "fdic_detect_risk_signals",
        "fdic_compare_bank_snapshots",
        "fdic_peer_group_analysis",
        "fdic_analyze_credit_concentration",
        "fdic_analyze_funding_profile",
        "fdic_analyze_securities_portfolio",
        "fdic_ubpr_analysis",
        "fdic_market_share_analysis",
        "fdic_franchise_footprint",
        "fdic_holding_company_profile",
        "fdic_regional_context"
      ],
      "forbidden": []
    }
  },
  "usage": "usage.md",
  "auth": null,
  "transport": "stdio",
  "evals": [],
  "adapters": {
    "claude": {
      "connector_name": "fdic-analysis-mcp",
      "extension_name": "fdic-analysis-mcp"
    },
    "openai": {
      "connector_name": "fdic-analysis-mcp"
    },
    "gemini": {
      "integration_name": "fdic-analysis-mcp"
    }
  }
}
